{
  "$schema": "https://json-schema.org/draft/2020-12/schema",
  "$id": "https://brand-atlas.dev/schemas/l3_assertion.schema.json",
  "title": "L3 Assertion",
  "description": "Schema for L3 assertions (Section 8.8/14.5 of L3 spec).",
  "type": "object",
  "required": ["subject", "predicate", "statement_text", "statement_class", "access_level"],
  "properties": {
    "subject": {"type": "string"},
    "predicate": {"type": "string"},
    "object": {"type": "string"},
    "object_value": {"type": "object"},
    "statement_text": {"type": "string"},
    "statement_class": {"type": "string", "enum": ["fact", "claim", "observation", "inference"]},
    "assertion_kind": {
      "type": "string",
      "enum": [
        "identity_fact", "product_spec", "self_claim", "attributed_claim",
        "third_party_fact", "internal_fact", "draft_claim", "inference"
      ]
    },
    "claimant": {"type": "string"},
    "scope": {"type": "object"},
    "limitations": {"type": "array", "items": {"type": "string"}},
    "verification_status": {"type": "string"},
    "publication_status": {"type": "string"},
    "access_level": {"type": "string", "enum": ["public", "internal", "confidential", "restricted"]},
    "confidence": {"type": ["number", "null"], "minimum": 0, "maximum": 1},
    "valid_from": {"type": "string", "format": "date"},
    "valid_to": {"type": "string", "format": "date"},
    "evidence_refs": {"type": "array", "items": {"type": "string"}},
    "supersedes_id": {"type": ["string", "null"]}
  }
}
